{
  "location": "Dublin City University",
  "start": 24,
  "end": 28,
  "month": "March",
  "year": 2017,
  "live": "2017-03-24T12:00:00",
  "archive": "false",
  "video": "https://www.youtube.com/embed/videoseries?list=PLPaLJSHTDMFhbDmyUeik6IHXmzVtWQQxu",
  "days": [{
    "day": "Monday",
    "description": "Data",
    "events": [{
      "name": "Opening Event",
      "by": "Redbrick DCU's Computer Networking Society",
      "time": "11:45",
      "place": {
        "id": "The Mezz",
        "map": "Somewhere in DCU"
      },
      "description": "Opening of TechWeek 2017"
    }, {
      "name": "TBA",
      "by": "TBA",
      "time": "12:00",
      "place": {
        "id": "The Mezz",
        "map": "Somewhere in DCU"
      },
      "description": "TBA"
    }, {
      "name": "Lunch",
      "by": "Food",
      "time": "14:00",
      "place": {
        "id": "The Mezz",
        "map": "Somewhere in DCU"
      },
      "description": "Lunch Time!"
    }, {
      "name": "TBA",
      "by": "TBA",
      "time": "15:00",
      "place": {
        "id": "The Mezz",
        "map": "Somewhere in DCU"
      },
      "description": "TBA"
    }]
  }, {
    "day": "Tuesday",
    "description": "Mobile Development",
    "events": [{
      "name": "TBA",
      "by": "TBA",
      "time": "12:00",
      "place": {
        "id": "The Mezz",
        "map": "Somewhere in DCU"
      },
      "description": "TBA"
    }, {
      "name": "Lunch",
      "by": "Food",
      "time": "14:00",
      "place": {
        "id": "The Mezz",
        "map": "Somewhere in DCU"
      },
      "description": "Lunch Time!"
    }, {
      "name": "TBA",
      "by": "TBA",
      "time": "15:00",
      "place": {
        "id": "The Mezz",
        "map": "Somewhere in DCU"
      },
      "description": "TBA"
    }]
  }, {
    "day": "Wednesday",
    "description": "Networks and IoT",
    "events": [{
      "name": "TBA",
      "by": "TBA",
      "time": "12:00",
      "place": {
        "id": "The Mezz",
        "map": "Somewhere in DCU"
      },
      "description": "TBA"
    }, {
      "name": "Lunch",
      "by": "Food",
      "time": "14:00",
      "place": {
        "id": "The Mezz",
        "map": "Somewhere in DCU"
      },
      "description": "Lunch Time!"
    }, {
      "name": "TBA",
      "by": "TBA",
      "time": "15:00",
      "place": {
        "id": "The Mezz",
        "map": "Somewhere in DCU"
      },
      "description": "TBA"
    }]
  }, {
    "day": "Thursday",
    "description": "STEM",
    "events": [{
      "name": "TBA",
      "by": "TBA",
      "time": "12:00",
      "place": {
        "id": "The Mezz",
        "map": "Somewhere in DCU"
      },
      "description": "TBA"
    }, {
      "name": "Lunch",
      "by": "Food",
      "time": "14:00",
      "place": {
        "id": "The Mezz",
        "map": "Somewhere in DCU"
      },
      "description": "Lunch Time!"
    }, {
      "name": "TBA",
      "by": "TBA",
      "time": "15:00",
      "place": {
        "id": "The Mezz",
        "map": "Somewhere in DCU"
      },
      "description": "TBA"
    }]
  }, {
    "day": "Friday",
    "description": "Lightning Talks",
    "events": [{
      "name": "TBA",
      "by": "TBA",
      "time": "12:00",
      "place": {
        "id": "The Mezz",
        "map": "Somewhere in DCU"
      },
      "description": "TBA"
    }, {
      "name": "Lunch",
      "by": "Food",
      "time": "14:00",
      "place": {
        "id": "The Mezz",
        "map": "Somewhere in DCU"
      },
      "description": "Lunch Time!"
    }, {
      "name": "TBA",
      "by": "TBA",
      "time": "16:00",
      "place": {
        "id": "The Mezz",
        "map": "Somewhere in DCU"
      },
      "description": "TBA"
    }]
  }]
}
